{
  "artifact_type": "delivery-receipt",
  "receipt_schema_version": "1.0",
  "delivered_at": "2026-08-06T19:17:17Z",
  "project_name": "AgentTeamsModule",
  "framework": "claude",
  "manifest_fingerprint": "9e741c42b10c80cf",
  "fingerprint_algo_version": 1,
  "output_dir": ".claude/agents",
  "agentteams_version": "1.0.0rc6"
}
