{
  "artifact_type": "delivery-receipt",
  "receipt_schema_version": "1.0",
  "delivered_at": "2026-08-16T21:43:39Z",
  "project_name": "ProjectRepositories",
  "framework": "copilot-vscode",
  "manifest_fingerprint": "25f69fb505dccb41",
  "fingerprint_algo_version": 1,
  "output_dir": "examples/project-repositories/expected",
  "agentteams_version": "1.0.0rc6"
}
