{
  "artifact_type": "delivery-receipt",
  "receipt_schema_version": "1.0",
  "delivered_at": "2026-08-17T12:02:31Z",
  "project_name": "SalesDataPipeline",
  "framework": "copilot-vscode",
  "manifest_fingerprint": "733c402f058f38ce",
  "fingerprint_algo_version": 1,
  "output_dir": "examples/data-pipeline/expected",
  "agentteams_version": "1.0.0rc6"
}
